{
  "$schema": "https://json-schema.org/draft/2020-12/schema",
  "$id": "https://pixel.local/schemas/activation-v2-a8-pending-operation-v1.json",
  "title": "ActivationV2A8PendingOperationV1",
  "type": "object",
  "additionalProperties": false,
  "required": ["schema_version", "journal_id", "operation", "packet_id", "packet_digest", "corpus_digest", "a7_packet_digest", "runtime_id", "previous_state", "next_state", "receipt", "pending_digest"],
  "properties": {
    "schema_version": {"const": 1}, "journal_id": {"$ref": "#/$defs/journal_id"}, "operation": {"enum": ["promotion_canary", "restore"]}, "packet_id": {"$ref": "#/$defs/packet_id"}, "packet_digest": {"$ref": "#/$defs/hash"}, "corpus_digest": {"$ref": "#/$defs/hash"}, "a7_packet_digest": {"$ref": "#/$defs/hash"}, "runtime_id": {"$ref": "#/$defs/runtime_id"}, "previous_state": {"$ref": "#/$defs/state"}, "next_state": {"$ref": "#/$defs/state"}, "receipt": {"$ref": "#/$defs/receipt"}, "pending_digest": {"$ref": "#/$defs/hash"}
  },
  "$defs": {
    "hash": {"type": "string", "pattern": "^[0-9a-f]{64}$", "maxLength": 64}, "project_id": {"type": "string", "pattern": "^[a-z0-9][a-z0-9._-]{0,63}$", "maxLength": 64}, "packet_id": {"type": "string", "pattern": "^a8-packet:[0-9a-f]{8}-[0-9a-f]{4}-[0-9a-f]{4}-[0-9a-f]{4}-[0-9a-f]{12}$", "maxLength": 46}, "runtime_id": {"type": "string", "pattern": "^runtime:[0-9a-f]{8}-[0-9a-f]{4}-[0-9a-f]{4}-[0-9a-f]{4}-[0-9a-f]{12}$", "maxLength": 44}, "journal_id": {"type": "string", "pattern": "^a8-journal:[0-9a-f]{8}-[0-9a-f]{4}-[0-9a-f]{4}-[0-9a-f]{4}-[0-9a-f]{12}$", "maxLength": 47}, "receipt_id": {"type": "string", "pattern": "^a8-promotion-receipt:[0-9a-f]{8}-[0-9a-f]{4}-[0-9a-f]{4}-[0-9a-f]{4}-[0-9a-f]{12}$", "maxLength": 59}, "backup_id": {"type": "string", "pattern": "^a8-backup:[0-9a-f]{8}-[0-9a-f]{4}-[0-9a-f]{4}-[0-9a-f]{4}-[0-9a-f]{12}$", "maxLength": 46}, "candidate_id": {"type": "string", "pattern": "^a8-candidate:[0-9a-f]{8}-[0-9a-f]{4}-[0-9a-f]{4}-[0-9a-f]{4}-[0-9a-f]{12}$", "maxLength": 49}, "global_object_id": {"type": "string", "pattern": "^kb:global:claim:[0-9a-f]{8}-[0-9a-f]{4}-[0-9a-f]{4}-[0-9a-f]{4}-[0-9a-f]{12}$", "maxLength": 64}, "candidate_state": {"type": "object", "additionalProperties": false, "required": ["candidate_id", "source_project_id", "global_object_id", "content_digest", "object_revision", "promotion_state"], "properties": {"candidate_id": {"$ref": "#/$defs/candidate_id"}, "source_project_id": {"$ref": "#/$defs/project_id"}, "global_object_id": {"$ref": "#/$defs/global_object_id"}, "content_digest": {"$ref": "#/$defs/hash"}, "object_revision": {"type": "integer", "minimum": 0, "maximum": 2147483647}, "promotion_state": {"enum": ["before", "promoted", "restored"]}}}, "state": {"type": "object", "additionalProperties": false, "required": ["schema_version", "packet_id", "packet_digest", "corpus_digest", "a7_packet_digest", "runtime_id", "synthetic_project_id", "state_revision", "phase", "candidates", "state_digest"], "properties": {"schema_version": {"const": 1}, "packet_id": {"$ref": "#/$defs/packet_id"}, "packet_digest": {"$ref": "#/$defs/hash"}, "corpus_digest": {"$ref": "#/$defs/hash"}, "a7_packet_digest": {"$ref": "#/$defs/hash"}, "runtime_id": {"$ref": "#/$defs/runtime_id"}, "synthetic_project_id": {"$ref": "#/$defs/project_id"}, "state_revision": {"type": "integer", "minimum": 0, "maximum": 2}, "phase": {"enum": ["initialized", "promoted", "restored"]}, "candidates": {"type": "array", "minItems": 1, "maxItems": 8, "items": {"$ref": "#/$defs/candidate_state"}}, "state_digest": {"$ref": "#/$defs/hash"}}}, "receipt": {"type": "object", "additionalProperties": false, "required": ["schema_version", "receipt_id", "operation", "status", "packet_id", "packet_digest", "corpus_digest", "a7_packet_digest", "runtime_id", "synthetic_project_id", "backup_id", "backup_digest", "expected_state_revision", "previous_state_revision", "state_revision", "candidate_states", "fixture_only", "network_calls", "global_target_access", "global_mutation", "authority_write", "persistent_user_memory_written", "created_at", "receipt_digest"], "properties": {"schema_version": {"const": 1}, "receipt_id": {"$ref": "#/$defs/receipt_id"}, "operation": {"enum": ["backup", "promotion_canary", "readback", "restore"]}, "status": {"enum": ["BACKUP_CREATED_SYNTHETIC", "PROMOTION_CANARY_APPLIED_SYNTHETIC", "PROMOTION_READBACK_MATCH_SYNTHETIC", "PROMOTION_RESTORED_SYNTHETIC"]}, "packet_id": {"$ref": "#/$defs/packet_id"}, "packet_digest": {"$ref": "#/$defs/hash"}, "corpus_digest": {"$ref": "#/$defs/hash"}, "a7_packet_digest": {"$ref": "#/$defs/hash"}, "runtime_id": {"$ref": "#/$defs/runtime_id"}, "synthetic_project_id": {"$ref": "#/$defs/project_id"}, "backup_id": {"$ref": "#/$defs/backup_id"}, "backup_digest": {"$ref": "#/$defs/hash"}, "expected_state_revision": {"type": "integer", "minimum": 0, "maximum": 2}, "previous_state_revision": {"type": "integer", "minimum": 0, "maximum": 2}, "state_revision": {"type": "integer", "minimum": 0, "maximum": 2}, "candidate_states": {"type": "array", "minItems": 1, "maxItems": 8, "items": {"$ref": "#/$defs/candidate_state"}}, "fixture_only": {"const": true}, "network_calls": {"const": 0}, "global_target_access": {"const": false}, "global_mutation": {"const": false}, "authority_write": {"const": false}, "persistent_user_memory_written": {"const": false}, "created_at": {"type": "string", "format": "date-time"}, "receipt_digest": {"$ref": "#/$defs/hash"}}}
  }
}
