{
  "a7_packet_digest": "bd78b868bba0f73f5dd64042a3ca9371b92350930016d23af310b47c828fc915",
  "corpus_digest": "7f3816ff0227937389595a226ce1b91e9ce4b705af46ae869a2e06ea3c3e54d7",
  "journal_id": "a8-journal:10000000-0000-4000-8000-000000000835",
  "next_state": {
    "a7_packet_digest": "bd78b868bba0f73f5dd64042a3ca9371b92350930016d23af310b47c828fc915",
    "candidates": [
      {
        "candidate_id": "a8-candidate:10000000-0000-4000-8000-000000000801",
        "content_digest": "bbbbbbbbbbbbbbbbbbbbbbbbbbbbbbbbbbbbbbbbbbbbbbbbbbbbbbbbbbbbbbbb",
        "global_object_id": "kb:global:claim:10000000-0000-4000-8000-000000000803",
        "object_revision": 5,
        "promotion_state": "promoted",
        "source_project_id": "v2-fixture"
      }
    ],
    "corpus_digest": "7f3816ff0227937389595a226ce1b91e9ce4b705af46ae869a2e06ea3c3e54d7",
    "packet_digest": "915bf31649b0214e5f12cd87ffd067610fdd038783d2cc07d97f37e1a59e77b0",
    "packet_id": "a8-packet:10000000-0000-4000-8000-000000000810",
    "phase": "promoted",
    "runtime_id": "runtime:10000000-0000-4000-8000-000000000820",
    "schema_version": 1,
    "state_digest": "1cf692e74de759cf8e4b138a6a01795ec74e7176becb3b1c29c3839326383a7e",
    "state_revision": 1,
    "synthetic_project_id": "v2-fixture"
  },
  "operation": "promotion_canary",
  "packet_digest": "915bf31649b0214e5f12cd87ffd067610fdd038783d2cc07d97f37e1a59e77b0",
  "packet_id": "a8-packet:10000000-0000-4000-8000-000000000810",
  "pending_digest": "2e5dfaad826f4ab9aa96e8b72c0ddb5dabd62d43e003a9a05d862cb794b97c54",
  "previous_state": {
    "a7_packet_digest": "bd78b868bba0f73f5dd64042a3ca9371b92350930016d23af310b47c828fc915",
    "candidates": [
      {
        "candidate_id": "a8-candidate:10000000-0000-4000-8000-000000000801",
        "content_digest": "aaaaaaaaaaaaaaaaaaaaaaaaaaaaaaaaaaaaaaaaaaaaaaaaaaaaaaaaaaaaaaaa",
        "global_object_id": "kb:global:claim:10000000-0000-4000-8000-000000000803",
        "object_revision": 4,
        "promotion_state": "before",
        "source_project_id": "v2-fixture"
      }
    ],
    "corpus_digest": "7f3816ff0227937389595a226ce1b91e9ce4b705af46ae869a2e06ea3c3e54d7",
    "packet_digest": "915bf31649b0214e5f12cd87ffd067610fdd038783d2cc07d97f37e1a59e77b0",
    "packet_id": "a8-packet:10000000-0000-4000-8000-000000000810",
    "phase": "initialized",
    "runtime_id": "runtime:10000000-0000-4000-8000-000000000820",
    "schema_version": 1,
    "state_digest": "ec4fa1e72cc99c027041bc3931e0173731a325bb62ed9b4846b186fdc35b3162",
    "state_revision": 0,
    "synthetic_project_id": "v2-fixture"
  },
  "receipt": {
    "a7_packet_digest": "bd78b868bba0f73f5dd64042a3ca9371b92350930016d23af310b47c828fc915",
    "authority_write": false,
    "backup_digest": "6f259b6cea53640a1f6ef79cd291514f59bcff334b78dcaed286d6563cb3c726",
    "backup_id": "a8-backup:10000000-0000-4000-8000-000000000830",
    "candidate_states": [
      {
        "candidate_id": "a8-candidate:10000000-0000-4000-8000-000000000801",
        "content_digest": "bbbbbbbbbbbbbbbbbbbbbbbbbbbbbbbbbbbbbbbbbbbbbbbbbbbbbbbbbbbbbbbb",
        "global_object_id": "kb:global:claim:10000000-0000-4000-8000-000000000803",
        "object_revision": 5,
        "promotion_state": "promoted",
        "source_project_id": "v2-fixture"
      }
    ],
    "corpus_digest": "7f3816ff0227937389595a226ce1b91e9ce4b705af46ae869a2e06ea3c3e54d7",
    "created_at": "2026-07-24T09:00:00Z",
    "expected_state_revision": 0,
    "fixture_only": true,
    "global_mutation": false,
    "global_target_access": false,
    "network_calls": 0,
    "operation": "promotion_canary",
    "packet_digest": "915bf31649b0214e5f12cd87ffd067610fdd038783d2cc07d97f37e1a59e77b0",
    "packet_id": "a8-packet:10000000-0000-4000-8000-000000000810",
    "persistent_user_memory_written": false,
    "previous_state_revision": 0,
    "receipt_digest": "906086730b38e6da9a5093244819155832f01d872c58207e0af0bf66dfa4629e",
    "receipt_id": "a8-promotion-receipt:10000000-0000-4000-8000-000000000832",
    "runtime_id": "runtime:10000000-0000-4000-8000-000000000820",
    "schema_version": 1,
    "state_revision": 1,
    "status": "PROMOTION_CANARY_APPLIED_SYNTHETIC",
    "synthetic_project_id": "v2-fixture"
  },
  "runtime_id": "runtime:10000000-0000-4000-8000-000000000820",
  "schema_version": 1
}
